{
  "apiVersion": "governance.sovrunn.io/v1alpha1",
  "kind": "AuditEvent",
  "metadata": {
    "createdAt": "2026-07-29T13:00:00Z",
    "displayName": "Audit F13-COMPAT-06",
    "generation": 1,
    "name": "audit-f13-compat-06",
    "resourceVersion": "rv-audit-f13-compat-06",
    "scopeRef": {
      "apiVersion": "provider.sovrunn.io/v1alpha1",
      "kind": "Provider",
      "name": "aws-provider",
      "uid": "provider-uid-compat-06"
    },
    "uid": "audit-uid-f13-compat-06",
    "updatedAt": "2026-07-29T13:00:00Z"
  },
  "record": {
    "action": "Create",
    "actorRef": {
      "apiVersion": "identity.sovrunn.io/v1alpha1",
      "kind": "Principal",
      "name": "operator-alice",
      "uid": "7e8f901a2b3c4d5e6f708192a3b4c5d6"
    },
    "operationRef": {
      "apiVersion": "ops.sovrunn.io/v1alpha1",
      "kind": "Operation",
      "name": "op-audit-f13-compat-06",
      "uid": "op-uid-f13-compat-06"
    },
    "outcome": "Succeeded",
    "reasonCode": "ACCEPTED",
    "requestId": "req-f13-compat-06",
    "subjectRef": {
      "apiVersion": "core.sovrunn.io/v1alpha1",
      "kind": "Project",
      "name": "payments-production",
      "uid": "a1b2c3d4e5f60718293a4b5c6d7e8f90"
    },
    "subjectResourceVersion": "rv-project-1"
  }
}
