{
  "apiVersion": "governance.sovrunn.io/v1alpha1",
  "kind": "AuditEvent",
  "metadata": {
    "name": "audit-project-create-001",
    "uid": "5c6d7e8f901a2b3c4d5e6f708192a3b4",
    "displayName": "Project Create Audit",
    "scopeRef": {
      "apiVersion": "tenancy.sovrunn.io/v1alpha1",
      "kind": "Organization",
      "name": "acme-org",
      "uid": "6d7e8f901a2b3c4d5e6f708192a3b4c5"
    },
    "generation": 1,
    "resourceVersion": "rv-audit-1",
    "createdAt": "2026-07-07T13:00:00Z",
    "updatedAt": "2026-07-07T13:00:00Z"
  },
  "record": {
    "actorRef": {
      "apiVersion": "identity.sovrunn.io/v1alpha1",
      "kind": "Principal",
      "name": "operator-alice",
      "uid": "7e8f901a2b3c4d5e6f708192a3b4c5d6"
    },
    "requestId": "req-audit-project-create-001",
    "operationRef": {
      "apiVersion": "ops.sovrunn.io/v1alpha1",
      "kind": "Operation",
      "name": "op-provision-platform-001",
      "uid": "8f901a2b3c4d5e6f708192a3b4c5d6e7"
    },
    "subjectRef": {
      "apiVersion": "core.sovrunn.io/v1alpha1",
      "kind": "Project",
      "name": "payments-production",
      "uid": "a1b2c3d4e5f60718293a4b5c6d7e8f90"
    },
    "subjectResourceVersion": "rv-project-1",
    "action": "Create",
    "outcome": "Succeeded",
    "reasonCode": "ACCEPTED"
  }
}
